{
  "title": "withdrawal",
  "description": "The transaction has one withdrawal whose reward account encodes a testnet stake-key credential equal to the input's payment key hash. The vkey witness already in the witness set satisfies both required signers (input + withdrawal), so phase-one must accept. Exercises withdrawals' post-parse loop (require_vkey_witness + withdraw_from).",
  "network": "preprod",
  "eraHistory": {
    "$ref": "common/eraHistory/preprod-conway.json"
  },
  "protocolParameters": {
    "$ref": "common/protocolParameters/preprod-conway-v9.json"
  },
  "initialState": {
    "utxo": [
      {
        "input": "825820827273a8722791f640b59ba20ba9340cb0398535b36e1957ed8e8dde693976d500",
        "output": "bf00581d6093c191b1094746961f6f00fba27f3d8eff6a66490baf806d4e179fd8011a004c4b40ff"
      }
    ],
    "governanceActivity": {
      "consecutiveDormantEpochs": 0
    }
  },
  "ledgerEnv": {
    "slot": 0,
    "txIx": 0
  },
  "transaction": "84a500d9010281825820827273a8722791f640b59ba20ba9340cb0398535b36e1957ed8e8dde693976d5000181bf00581d60a1c146c212acfe02048afbf8d2e5e9c806165934d9935c696f85c3dc011a00493e00ff021a00030d4005a1581de093c191b1094746961f6f00fba27f3d8eff6a66490baf806d4e179fd8000f00a100d90102818258202152f8d19b791d24453242e15f2eab6cb7cffa7b6a5ed30097960e069881db125840af6fadeea421a05c6fd70eccc3a3c2333934dae7ad880a31d44457b68ff73c18bfcc25e5b43a2cc28540866043cb545d28c2d0037006154665b1f9a58ca97600f5f6",
  "expected": "Pass"
}
