{
  "title": "auxiliary-data-raw-hash",
  "description": "Based on a real transaction from preprod (a7a5b486773edf68c2874d2fd2737f20385be108d31fb25a0be5246d73b7660a) that used an unexpected encoding.",
  "network": "preprod",
  "eraHistory": {
    "$ref": "common/eraHistory/preprod-conway.json"
  },
  "protocolParameters": {
    "$ref": "common/protocolParameters/preprod-conway-v9.json"
  },
  "initialState": {
    "utxo": [
      {
        "input": "825820f8791dcdb710a190564a9d7642d9cadb2da965088ff803a7bcdf5aa62341c3b600",
        "output": "a200581d6093c191b1094746961f6f00fba27f3d8eff6a66490baf806d4e179fd8011a004c4b40"
      }
    ],
    "governanceActivity": {
      "consecutiveDormantEpochs": 0
    }
  },
  "ledgerEnv": {
    "slot": 0,
    "txIx": 0
  },
  "transaction": "84a400d9010281825820f8791dcdb710a190564a9d7642d9cadb2da965088ff803a7bcdf5aa62341c3b600018182581d60ff384de9ccf2eac9b6c0038fd30b79dd61128ab2777e7b90e8d3893d1a3b97cfd7021a0002fa29075820781a82583cfa3d80ba91105eee47f894b4f7791ea948e3d169dac2534ad1264aa100d90102818258202152f8d19b791d24453242e15f2eab6cb7cffa7b6a5ed30097960e069881db1258408695feba9212d9037ec8e98a1040406495a413c5daa0da55a9973b9b0a271717df5da038f4f2d79566e9dafc3336303cec7243e0d0ac1ae01f9c04ec979b7b0df5d90103a200a2056763617264616e6f066572756c65730181830302958200581cff384de9ccf2eac9b6c0038fd30b79dd61128ab2777e7b90e8d3893d8200581c91353b7b4ddbe44e9517935e866d7390e333e9cf375e2908549645918200581c39802d9e25d91dfde6c25b24f098199b9fc237bdc5223d68dd1a1f418200581cbac824e971532e22d64d161071c5f8293eeb71d2a52f96d270ee32468200581cb9e7acca0cc79602e5aa9e396b6faaa00e45e514f3203ff5a0d82d878200581cde19c568e9eccba2cb4d7045b0ba1d0d1a5d197c51e6b8c91fa51ace8200581cb718e858f4664e7d22361dfdfa805fc2aeb6b5b668cd126f5a2800c08200581ccb95e66508923fce4464fbd5d508dce031795437344a9c5fc01490858200581c3b5a1880cc79d61852add0917fd604b7d875a862f3321c3ba11d9f5d8200581c8e7eb4c1427864243ee19cd1de15c679650ec382ceb0ace87b2742b88200581ca436a4e3f8df7b3233d37e9c5d4f7cd16652c0cfea63bc64b0af7afa8200581cd89702ce1a255f3a1a733b0ed88384b2c52da6904fbc7a46bd6426048200581ce3febc2d1b3a843ec3bff02b64cedba9df6cade171bfe3539af4cbed8200581cb22982a2b39103c7326b9105d9aa7780416032ae6ed1e901609a35248200581c3f05ef90357061f5d17341fa38c17a6a55805e4e9f5b9c98e584eb3c8200581cef271b4ee6d08a268b3597693e1c1b1c6e9b9ba092d7d7b5c7997bd78200581c01bc0fcd7ac4ba12a6d23dfa96b935310a5879ba711908bf830062088200581c812dd68ade50407c44eab9a85802849d77095d59ca95dbbe979917888200581c4eb2e8035e789a62f73d2129402585279fb0175403ae5b926d101c0f8200581c46bf4a8428022a16646583f9dfb00115a2b50632fbc84abc2dfbb6e882051903e8",
  "expected": "Pass"
}
