{
  "title": "validity-interval-both-bounds",
  "description": "validity_interval = [50, 200) (exclusive upper) and ledgerEnv.slot = 100; the slot lies strictly inside the interval, so phase-one must accept.",
  "network": "preprod",
  "eraHistory": {
    "$ref": "common/eraHistory/preprod-conway.json"
  },
  "protocolParameters": {
    "$ref": "common/protocolParameters/preprod-conway-v9.json"
  },
  "initialState": {
    "utxo": [
      {
        "input": "825820827273a8722791f640b59ba20ba9340cb0398535b36e1957ed8e8dde693976d500",
        "output": "bf00581d6093c191b1094746961f6f00fba27f3d8eff6a66490baf806d4e179fd8011a004c4b40ff"
      }
    ],
    "governanceActivity": {
      "consecutiveDormantEpochs": 0
    }
  },
  "ledgerEnv": {
    "slot": 100,
    "txIx": 0
  },
  "transaction": "84a600d9010281825820827273a8722791f640b59ba20ba9340cb0398535b36e1957ed8e8dde693976d5000181bf00581d60a1c146c212acfe02048afbf8d2e5e9c806165934d9935c696f85c3dc011a00493e00ff021a00030d400318c80818320f00a100d90102818258202152f8d19b791d24453242e15f2eab6cb7cffa7b6a5ed30097960e069881db125840004a6d4df2f19b9bc378d7b7e92b53f21cb49d2fc35e0d4ad64d3ac3e5c67ad5e6914ffe75cf5090b079f3ff3bb9c18564598e9df498b499e329b0d1f8877907f5f6",
  "expected": "Pass"
}
