{
  "title": "validity-interval-end-only",
  "description": "validity_interval = [None, 200) (no lower bound) and ledgerEnv.slot = 100; the slot is below the upper bound, so phase-one must accept.",
  "network": "preprod",
  "eraHistory": {
    "$ref": "common/eraHistory/preprod-conway.json"
  },
  "protocolParameters": {
    "$ref": "common/protocolParameters/preprod-conway-v9.json"
  },
  "initialState": {
    "utxo": [
      {
        "input": "825820827273a8722791f640b59ba20ba9340cb0398535b36e1957ed8e8dde693976d500",
        "output": "bf00581d6093c191b1094746961f6f00fba27f3d8eff6a66490baf806d4e179fd8011a004c4b40ff"
      }
    ],
    "governanceActivity": {
      "consecutiveDormantEpochs": 0
    }
  },
  "ledgerEnv": {
    "slot": 100,
    "txIx": 0
  },
  "transaction": "84a500d9010281825820827273a8722791f640b59ba20ba9340cb0398535b36e1957ed8e8dde693976d5000181bf00581d60a1c146c212acfe02048afbf8d2e5e9c806165934d9935c696f85c3dc011a00493e00ff021a00030d400318c80f00a100d90102818258202152f8d19b791d24453242e15f2eab6cb7cffa7b6a5ed30097960e069881db125840636609556adb8bb3cb2ff73e52cc98f5a5056530544ccafc68816e2ebcb764c591d53c4687c429a5fa1c5ab1c1ee0a0e88991059f300bbf5c9187e78fe170200f5f6",
  "expected": "Pass"
}
